id,name,description
100,Havel's Ring,"This ring was named after Havel the Rock, Lord Gwyn's old battlefield compatriot.  Havel's men wore the ring to express faith in their leader and to carry a heavier load."
101,Red Tearstone Ring,The rare gem called tearstone has the uncanny ability to sense imminent death.  This red tearstone from Carim boosts the attack of its wearer when in danger.
102,Darkmoon Blade Covenant Ring,"Ring granted to those bound by the Darkmoon Blade covenant. Answer Dark Sun Gwyndolin's summoning.  Gwyndolin, all too aware of his repulsive, frail appearance, created the illusion of  a sister Gwynevere, who helps him guard over Anor Londo. An unmasking of these deities would be tantamount to blasphemy."
103,Cat Covenant Ring,Ring granted to those bound by the Forest Hunter covenant. Answer Alvina's summoning.  The white cat Alvina speaks a human tongue and has lived since the early Age of Fire. Alvina was a trusted friend of Knight Artorias and the Great Wolf Sif.
104,Cloranthy Ring,"This ancient ring, engraved with a large green flower, is of unknown origin.  Hastens the regeneration of stamina."
105,Flame Stoneplate Ring,"Stoneplates, the symbol of a true knight, grant the strength to face various hardships.  The red stoneplate symbolizes fire, and boosts defence against flame."
106,Thunder Stoneplate Ring,"Stoneplates, the symbol of a true knight, grant the strength to face various hardships.  The yellow stoneplate symbolizes thunder, and boosts defence against lightning."
107,Spell Stoneplate Ring,"Stoneplates, the symbol of a true knight, grant the strength to face various hardships.  The blue stoneplate symbolizes souls, and boosts defence against magic."
108,Speckled Stoneplate Ring,"Stoneplates, the symbol of a true knight, grant the strength to face various hardships.  The precious rare speckled stoneplate grants a small boost to defence against magic, flame, and lightning."
109,Bloodbite Ring,"One of the infamous bite rings commissioned by Sir Arstor of Carim.  Despite the dreadful rumors surrounding its creation, this ring is an unmistakable asset, in its ability to help prevent bleeding."
110,Poisonbite Ring,"One of the infamous bite rings commissioned by Sir Arstor of Carim.  Despite the dreadful rumors surrounding its creation, this ring is an unmistakable asset, in its ability to help prevent poison."
111,Tiny Being's Ring,"Ring made of an ancient tiny red jewel. Grants small increase to HP.  Rings grant powers large and small. Their discovery, and effective use, can make one's journey easier."
113,Cursebite Ring,"One of the infamous bite rings commissioned by Sir Arstor of Carim.  Despite the dreadful rumors surrounding its creation, this ring is an unmistakable asset, in its ability to help prevent curses."
114,White Seance Ring,"A divine ring entrusted to the head bishop of the Way of White and apostle to Allfather Lloyd, uncle to Lord Gwyn. It grants additional attunement slots.  The head bishop of the Way of White is the guardian of law and caste, and one of the great royals of Thorolund."
115,Bellowing Dragoncrest Ring,"A special ring granted to only the most accomplished sorcerers at Vinheim Dragon School.  The ring is engraved with an everlasting dragon, and boosts the strength of sorceries."
116,Dusk Crown Ring,"This magic crown-shaped ring was granted to princess Dusk of Oolacile upon her birth.  The ringstone allows its wearer to cast additional sorceries, but at the cost of one-half of HP."
117,Hornet Ring,"One of the special rings granted to the four knights of Gwyn. The Hornet Ring belonged to the Lord's Blade Ciaran.  By boosting critical attacks, its wearer can annihilate foes, as Ciaran's dagger laid waste to Lord Gwyn's enemies."
119,Hawk Ring,"One of the special rings granted to the four knights of Gwyn. The Hawk Ring belonged to Hawkeye Gough, who led the Greatarchers.  Boosts bow range, so that arrows fly like they were shot by Gough's great bow, which took down high-flying dragons."
120,Ring of Steel Protection,"This ring belonged to the Knight King Rendal. It grants its wearer protection by boosting defense against physical attacks.  Of the many legends surrounding the Knight King Rendal, one of the more well-known speaks of his standing down a giant drake and slashing it to pieces."
121,Covetous Gold Serpent Ring,"The serpent is an imperfect dragon and symbol of the Undead. Its habit of devouring prey even larger than itself has led to an association with gluttony.  This gold ring, engraved with the serpent, boosts its wearer's item discovery, so that more items can be amassed."
122,Covetous Silver Serpent Ring,"The serpent is an imperfect dragon and symbol of the Undead. Its habit of devouring prey even larger than itself has led to an association with gluttony.  This silver ring, engraved with the serpent, rewards its wearer with additional souls for each kill."
123,Slumbering Dragoncrest Ring,"This ring was secretly worn by a certain surreptitious sorcerer at Vinheim Dragon School.  The ring is engraved with an everlasting dragon in silent slumber, and masks all sound emitting from its wearer."
124,Ring of Fog,"Those who befriend Alvina are given this mysterious ring. It resembles a pearl with its robust pure-white fog.  The ring camouflages its wearer's presence, helping to prevent detection."
125,Rusted Iron Ring,"This iron ring was used to shackle the guilty. It is terribly rusted, and faintly stained with blood.  Those who find this strange ring to their liking will be pleased to find it easier to gain footing on poor ground such as swamps."
126,Ring of Sacrifice,"This mystical ring was created in a sacrificial rite of Velka, the Goddess of Sin.  Its wearer will lose nothing upon death, but the ring itself breaks."
127,Rare Ring of Sacrifice,"This mystical ring was created in a sacrificial rite of Velka, the Goddess of Sin. The magenta-shaded ring is especially rare.  Its wearer will lose nothing upon death, and will be freed from any curse whatsoever, but the ring itself breaks."
128,Dark Wood Grain Ring,"This special ring crafted in an Eastern land is made of gold, but with a wood grain crest on its surface.  Agents of subterfuge in this faraway land are particularly fond of the dark gold wood grain, which greatly alters its wearer's rolling action."
130,Ring of the Sun Princess,"This ring is granted to those who enter a Covenant with Gwynevere, daughter of Lord Gwyn and the Princess of Sunlight. This slightly warm ring boosts the synergy of miracles.  The Princess of Sunlight Gwynevere left Anor Londo along with many other deities, and later became wife to Flame God Flann."
133,Ring of Condemnation,"This black diamond ring is granted to those who enter a Covenant with Velka, the Goddess of Sin. It automatically counterattacks when its wearer inflicts sustained damage.  Velka the Goddess of Sin is an eccentric witch versed in various secret rites, an"
134,Ring of Blind Ghosts,"This ring belonged to the seal guardian of New Londo. It prevents its wearer's discovery by cursed ghosts.  There were once three guardians of the seal, but two of them tired of their eternal task, and left New Londo long ago."
137,Old Witch's Ring,"Old ring from an old witch.  Engraved minutely with indecipherable script, but seemingly useless."
138,Covenant of Artorias,"This ring symbolizes Knight Artorias's covenant with the beasts of the Abyss.  Its wearer, like Artorias himself, can traverse the Abyss."
139,Orange Charred Ring,"An orange ring enchanted by a witch. Reduces lava damage.  Since his sores were inflamed by lava from birth, his witch sisters gave him this special ring. But fool that he is, he readily dropped it, and from that spot, a terrible centipede demon was born."
140,Ring of Displacement,"The ring of a lost miracle of New Londo. This ring takes damage in place of its wearer, but has a fixed chance of breaking.  As evidenced by this ring, the culture of New Londo was unique, and its flooding is widely considered to be a great loss."
141,Lingering Dragoncrest Ring,"A special ring granted to only the most accomplished sorcerers at Vinheim Dragon School.  The ring is engraved with a lingering dragon, and boosts the length of the effects of sorceries."
142,Ring of the Evil Eye,"According to legend, this ring contains the spirit of the evil eye, a dark beast which assaulted Astora.  The strength of the evil eye does not waver, and HP is absorbed from fallen enemies."
143,Ring of Favor and Protection,"A ring symbolizing the favor and protection of the goddess Fina, known in legend to possess ""fateful beauty.""  This ring boosts its wearer's HP, stamina, and max equipment load, but breaks if ever removed."
144,Leo Ring,One of the special rings granted to the four knights of Gwyn. The Leo Ring belonged to Ornstein the Dragonslayer.  This ring strengthens counters with pierce weapons. His lugged spear is said to have sliced a boulder in two.
145,East Wood Grain Ring,"This special ring crafted in an Eastern land is made of gold, but with a wood grain crest on its surface.  The ring slows the loss of weapon durability and is particularly useful to bearers of delicate swords crafted in the East."
146,Wolf Ring,"One of the special rings granted to the four knights of Gwyn. The Wolf Ring belongs to Artorias the Abysswalker.  Artorias had an unbendable will of steel, and was unmatched with a greatsword."
147,Blue Tearstone Ring,The rare gem called tearstone has the uncanny ability to sense imminent death.  This blue tearstone from Catarina boosts the defence of its wearer when in danger.
148,Ring of the Sun's Firstborn,"Lord Gwyn's firstborn, who inherited the sunlight, once wore this ancient ring. Boosts the strength of miracles.  Lord Gwyn's firstborn was a god of war, but his foolishness led to a loss of the annals, and rescinding of his deific status. Today, even his name is not known."
149,Darkmoon Seance Ring,"This ring is granted to adherents of Gwyndolin, Darkmoon deity and last born of Gwyn, Lord of Sunlight. Grants additional magic attunement slots.  The Dark Sun Gwyndolin is the only remaining deity in Anor Londo. His followers are few, but their tasks are of vital importance."
10000,Blade of the Darkmoon,"A silver pendant depicting the Darkmoon and a sword, the crest of the Darkmoon Knights, the original Blue Sentinels. Equip to pledge oneself to the Blade of the Darkmoon covenant.  When a member of the Way of Blue faces a dark spirit, the Blades of the Darkmoon, by an ancient accord, help to root out the invader. Summoning takes place automatically when equipped."
10020,Watchdogs of Farron,"Ancient medallion depicting the crest of a wolf. Symbolizes the pact with the Old Wolf of Farron. Equip to pledge oneself to the Watchdogs of Farron.  The Watchdogs ensure that the warriors sleep in serenity, by taking the form of loyal spirits and hunting down those who would trespass the woods of Farron.  Summoning takes place automatically while this is equipped."
10030,Aldrich Faithful,"The holy symbol of the Cathedral of the Deep, and crest of those who see beyond fire to the age of deep waters. Equip to pledge oneself to the Aldrich Faithful covenant.  The Faithful ensure that Aldrich, Devourer of Gods, remains undisturbed, by taking the form of loyal spirits and hunting down those who would trespass the ruined cathedral.  Summoning takes place automatically while this is equipped."
10040,Warrior of Sunlight,"An ancient talisman depicting a holy symbol bestowed upon the Warriors of Sunlight. Equip to pledge oneself to the Warrior of Sunlight covenant.  Warriors of Sunlight are brilliantly beaming co-operators who place their golden signatures to help those in need, for it is their duty to deliver a great conquest to their summoner."
10050,Mound-makers,"A malformed vertebra found by the mad, with a queer symbol on its inside, proof of the shackles of the Gods. Equip to pledge oneself to the Mound-makers covenant.  The mound-makers wish only to add to their mounds, becoming mad spirits whether summoned as co-operators or invaders.  They are blithe to those around them, for in their minds, any kill might lead to another shackle."
10060,Way of Blue,"Pale blue sheepskin parchment featuring an illustration of the moon, symbol of an ancient accord.  Members of the Way of Blue are the beneficiaries of an ancient accord. When a dark spirit threatens them, a blue spirit will grant them assistance, and help to root out the invader.  Summoning takes place automatically while this is equipped."
10070,Blue Sentinels,"Faded sheepskin parchment depicting the Darkmoon and a sword. Equip to pledge oneself to the Blue Sentinels covenant.  When a member of the Way of Blue is threatened by a dark spirit, the Blue Sentinels, in compliance with an ancient accord, assume the form of blue spirits, and help to root out the invader.  Summoning takes place automatically while this is equipped."
10080,Rosaria's Fingers,"Sacred seal of Archdeacon Klimt, who served Rosaria, Mother of Rebirth. Equip to pledge oneself to the Rosaria's Fingers covenant.  Rosaria's Fingers collect tongues in her name. Some do it to be reborn; others do it to help comfort their voiceless goddess."
20000,Life Ring,"A generations-old ring set with a small red jewel. Raises maximum HP.  Rings have unique powers, and their discovery will do much to ease a wearisome journey."
20010,Chloranthy Ring,"This old ring is named for its decorative green blossom, but its luster is long since faded.  Raises stamina recovery speed."
20020,Havel's Ring,"A ring for warriors keen on heavy accoutrements. Increases maximum equip load.  This ring was named after Havel the Rock, the battlefield compatriot of Gwyn, the First Lord.  The art of war has been a constant since ages past, and those who would follow in Havel's footsteps are no fewer now than in his own day."
20030,Ring of Favor,"A ring symbolizing the favor of the Goddess Fina, whose ""fateful beauty"" is mentioned in legend.  True to the fickle nature of Fina's favor, her ring increases max HP, stamina, and maximum equip load."
20040,Ring of Steel Protection,"Ring of the Knight King of ancient legend. Increases physical damage absorption.  The Knight King was said to be lined with steel on the inside, such that even the talons of mighty dragons did him little harm."
20050,Flame Stoneplate Ring,"Stoneplates are symbols of true knights, and red stoneplates are granted to those who valiantly face Chaos.  Increases fire damage absorption."
20060,Thunder Stoneplate Ring,"Stoneplates are symbols of true knights, and yellow stoneplates are granted to those who would become dragons.  Increases lightning damage absorption."
20070,Magic Stoneplate Ring,"Stoneplates are symbols of true knights, and blue stoneplates are granted to the royal palace guards.  Increases magic damage absorption."
20080,Dark Stoneplate Ring,"Stoneplates are symbols of true knights, and dark purple stoneplates are granted to Undead knights.  Increases dark damage absorption."
20090,Speckled Stoneplate Ring,"Stoneplates are symbols of true knights, and speckled stoneplates are granted to those who face an endless journey.  Slightly increases magic, lightning, fire and dark damage absorption."
20100,Bloodbite Ring,"One of the bite rings native to Carim. Increases bleed resistance.  The crafting of these rings is forbidden, perhaps owing to a fear of malleable stone. Clerics, however, dabble freely in the art."
20110,Poisonbite Ring,"One of the bite rings native to Carim. Increases poison resistance.  The crafting of these rings is forbidden, perhaps owing to a fear of malleable stone. Clerics, however, dabble freely in the art."
20120,Cursebite Ring,"One of the bite rings native to Carim. Increases curse resistance.  The crafting of these rings is forbidden, perhaps owing to a fear of malleable stone. Clerics, however, dabble freely in the art."
20130,Fleshbite Ring,"One of the bite rings native to Carim. Raises poison, bleed, frost and curse resist.  The crafting of these rings is forbidden, perhaps owing to a fear of malleable stone. Clerics, however, dabble freely in the art."
20140,Wood Grain Ring,"This special ring crafted in an Eastern land is made of metal, but with a wood grain crest on its surface. Slows equipment degradation.  Wielders of swords originating in the same region follow a practice of inscribing special words on the blades of their swords, and are naturally drawn to this ring."
20150,Scholar Ring,"A ring engraved with a portrait of a scholar. Increases intelligence.  In Lothric, the Scholar has long been considered one of the Three Pillars of the king's rule, and is therefore master of the Grand Archives."
20160,Priestess Ring,"A ring engraved with a portrait of the High Priestess. Increases faith.  In Lothric, the High Priestess has long been considered one of the Three Pillars of the king's rule. The High Priestess also served as the prince's wet nurse."
20170,Red Tearstone Ring,"A ring set with a large rare tearstone jewel. Temporarily boosts attack when HP is low.  This stone is said to be a tear of mourning of the goddess Caitha, and of course, tears are always more beautiful near death."
20180,Blue Tearstone Ring,"A ring set with a large rare tearstone jewel. Temporarily boosts damage absorption when HP is low.  This stone is said to be a tear of sorrow of the goddess Caitha, and of course, tears are always more beautiful near death."
20190,Wolf Ring,"Ring associated with Abysswalker Artorias, one of the Four Knights of Gwyn, the First Lord.  Increases poise.  Artorias had an unbendable will of steel, and was unmatched with a greatsword."
20200,Leo Ring,"Ring associated with Dragon Slayer Ornstein, one of the Four Knights of Gwyn, the First Lord.  Strengthens thrust weapon counter attacks.  Ornstein was the first knight of the sun's eldest born, and his cross spear is said to have pierced scales made of stone."
20210,Ring of Sacrifice,"This mystical ring was created in a sacrificial rite of Velka, the Goddess of Sin.  Its wearer will lose nothing upon death, but the ring itself breaks.  A sacrifice is only worth as much as the life it spares."
20220,Rare Ring of Sacrifice,"This mystical ring was created in a sacrificial rite of Velka, the Goddess of Sin. This magenta-shaded ring is especially rare.  Its wearer will lose nothing upon death, and will be freed from any curse whatsoever, but the ring itself breaks.  A sacrifice is only worth as much as the life it spares."
20230,Young Dragon Ring,"Ring given in Vinheim, home of sorcery, when newly ordained as a sorcerer.  Boosts sorceries.  Apropos to the Dragon School, the seal depicts an everlasting dragon. A young dragon presages the great length of the journey to mastery."
20231,Bellowing Dragoncrest Ring,"A special ring given to those who are deemed fit to undertake the journey of discovery in Vinheim, home of sorcery.  Greatly boosts sorceries.  Apropos to the Dragon School, the seal depicts an everlasting dragon. A bellowing dragon symbolizes the true nature of the consummate sorcerer."
20240,Great Swamp Ring,"Ring said to be chiseled from the bone of a flame salamander by blighted Pyromancers living in the Great Swamp.  Boosts pyromancies.  It is believed that salamanders are the descendants of demons, born of the Chaos Flame, from which Pyromancy is also said to have originated."
20241,Witch's Ring,"The Witch of Izalith and her daughters, scorched by the Flame of Chaos, taught humans the art of pyromancy and offered them this ring.  Greatly boosts pyromancies.  Every pyromancer is familiar with the parable that tells of the witches espousing the need to fear the flame, and teaching the art of pyromancy to men in hopes that they might learn to control it."
20250,Morne's Ring,A malformed ring given to knights of Carim.  Boosts miracles.  Morne served the goddess Caitha and later became an apostle of the Archbishop. They labored together to provide comfort to the suffering.
20251,Ring of the Sun's First Born,"Ring of the Sun's first born, who inherited the light of Gwyn, the First Lord.  Greatly boosts miracles.  The Sun's first born was once a god of war, until he was stripped of his stature as punishment for his foolishness. No wonder his very name has slipped from the annals of history."
20270,Lingering Dragoncrest Ring,"A special ring given to those who are deemed fit to undertake the journey of discovery in Vinheim, home of sorcery.  Extends length of spell effect.  Apropos to the Dragon School, the seal depicts an everlasting dragon. A lingering dragon symbolizes the true nature of the consummate sorcerer."
20280,Sage Ring,"A ring given to Farron's Undead Legion by one of the preacher twins, known more commonly as the Crystal Sages.  Shortens spell casting time.  The sorcerers of Farron's Abyss Watchers were known to be lonesome warriors who would only rely upon more pragmatic spells."
20290,Slumbering Dragoncrest Ring,"Ring of a clandestine guild of sorcerers based in Vinheim, home of sorcery.  Masks the sound of its wearer.  The Dragon School held effective sovereignty over Vinheim, with a great many adept assassins at its disposal."
20300,Dusk Crown Ring,"Leaf-colored crown ring bestowed upon the princess of Oolacile, ancient land of golden sorceries.  Reduces spell FP consumption, but also lowers HP.  Oolacile is synonymous for its lost sorceries, of which the xanthous sorcerers are dedicated scholars. This crown ring is a rare artifact of great magic heritage."
20310,Saint's Ring,"A ring bestowed upon a Carim saint. Allows attunement of additional spells.  In Carim, the saints give voice to the ancient tales. They memorize countless cumbersome sacred books and read them in sonorous tones, a function for which they are widely renowned."
20320,Deep Ring,"A ring bestowed upon the Deacons of the Cathedral of the Deep. Allows attunement of additional spells.  In the Cathedral slumber things most terrible, and as such, the deacons require a grand narrative, to ensure they do not falter in their duty. A philosophy, to ward away the madness beckoned by the grotesqueries at hand."
20330,Darkmoon Ring,"Ring of the moon deity Gwyndolin, youngest son of Gwyn, the First Lord.  Adds many slots for attunement.  Gwyndolin, also known as the Dark Sun, commands the Darkmoon Knights, and bestows this ring upon the best of them."
20340,Ring of the Sun's Firstborn,"Lord Gwyn's firstborn, who inherited the sunlight, once wore this ancient ring. Boosts the strength of miracles.  Lord Gwyn's firstborn was a god of war, but his foolishness led to a loss of the annals, and rescinding of his deific status. Today, even his name is not known."
20350,Darkmoon Blade Covenant Ring,"Ring granted to those bound by the Darkmoon Blade covenant. Answer Dark Sun Gwyndolin's summoning.  Gwyndolin, all too aware of his repulsive, frail appearance, created the illusion of  a sister Gwynevere, who helps him guard over Anor Londo. An unmasking of these deities would be tantamount to blasphemy."
20360,Leo Ring,One of the special rings granted to the four knights of Gwyn. The Leo Ring belonged to Ornstein the Dragonslayer.  This ring strengthens counters with pierce weapons. His lugged spear is said to have sliced a boulder in two.
20370,Hawk Ring,"Ring associated with Hawkeye Gough, one of the Four Knights of Gwyn, the First Lord.  Extends the range of arrows.  In his later years, the giant Gough was blinded, but this did not prevent him from striking down a calamitous dragon with his Greatbow."
20380,Hornet Ring,"Ring associated with the Lord's Blade Ciaran, one of the Four Knights of Gwyn, the First Lord.  Boosts critical attacks.  The masked Ciaran was the only woman to serve in Gwyn's Four Knights, and her curved sword granted a swift death to any and all enemies of the throne."
20390,Covetous Gold Serpent Ring,"A gold ring depicting a snake that could have been, but never was, a dragon. Fallen foes are more likely to drop items.  Snakes are known as creatures of great avarice, devouring prey even larger than themselves by swallowing them whole.  If one's shackles are cause for discontent, perhaps it is time for some old-fashioned greed."
20400,Covetous Silver Serpent Ring,"A silver ring depicting a snake that could have been, but never was, a dragon. Fallen foes yield more souls.  Snakes are known as creatures of great avarice, devouring prey even larger than themselves by swallowing them whole.  If one's shackles are cause for discontent, perhaps it is time for some old-fashioned greed."
20410,Sun Princess Ring,"Ring associated with Gwynevere, princess of sunlight and eldest daughter of Gwyn, the First Lord.  The ring is vaguely warm, like a beam of sunlight, and gradually restores HP.  Gwynevere left her home with a great many other deities, and became a wife and mother, raising several heavenly children."
20420,Silvercat Ring,"Silver ring depicting a leaping feline. Prevents damage from falling.  In the Age of Gods, or possibly just following it, an old cat was said to speak a human tongue, with the voice of an old woman, and the form of a fanciful immortal."
20430,Skull Ring,"One of Courland's transposed wonders. Derived from the soul of a Soulfeeder.  Easier to be detected by enemies.  The Soulfeeder was a beast that insatiably absorbed souls to feed its own power. Even after its accursed corpse was burned, it is said that the pungent stench of souls left the air permanently stained."
20440,Untrue White Ring,"One of the illusory rings worn by the Hollows of Londor.  Take the appearance of a phantom.  The Hollows of Londor are wretchedly aged, fraught with deceit, and dubiously secretive. It is no wonder that they are deeply detested."
