id,name,description
25000000,Silver Mask,"Silver mask of Ringfinger Leonhard.  In his youth, Leonhard suffered grave burns to his entire body. His face in particular, which he hid beneath his mask, was terribly scalded.  He abstained from restoring these injuries, even after becoming a Finger of Rosaria,"
25001000,Leonhard's Garb,"Garb of Ringfinger Leonhard.  Leonhard was born into royalty, which is believed to be the reason for his skill in both sorcery and swordsmanship.  Indeed, this dingy garb is in fact embroidered with gold thread, betraying its purpose as military wear designed for a noble."
25002000,Leonhard's Gauntlets,"Gauntlets of Ringfinger Leonhard.  Leonhard was born into royalty, which is believed to be the reason for his skill in both sorcery and swordsmanship.  Indeed, these dingy gauntlets are in fact decorated with silver, betraying their purpose as military wear designed for a noble."
25003000,Leonhard's Trousers,"Trousers of Ringfinger Leonhard.  Leonhard was born into royalty, which is believed to be the reason for his skill in both sorcery and swordsmanship.  Indeed, these dingy trousers are in fact meticulously tanned, betraying their purpose as military wear designed for a noble."
25500000,Sneering Mask,"Gold mask worn by those who kill in the name of the Sable Church of Londor.  A faint, kindly smile is bound to its surface, giving them the moniker Harlots of Death.  What lies beneath that expression, however, is nothing more than the face of a darkly shriveled Hollow."
25501000,Pale Shade Robe,"Attire worn by those who kill in the name of the Sable Church of Londor.  The Pale Shades of the Sable Church are all undying Hollows, giving rise to much fear and contempt.  Their fight is one of neither honor nor exaltation, yielding nothing but withered moans."
25502000,Pale Shade Gloves,"Outfit worn by those who kill in the name of the Sable Church of Londor.  The Pale Shades of the Sable Church are all undying Hollows, giving rise to much fear and contempt.  Their fight is one of neither honor nor exaltation, yielding nothing but withered moans."
26000000,Sunset Helm,"Helm of Hodrick, holy knight of the Sunless Realms.  This light gold helm, named for its sunset hues, is now faded and wrapped in tainted rags.  The sorry fool was known to wander the battlefield as a crazed ghoul, lashing out at friend and foe alike."
26001000,Sunset Armor,"Armor of Hodrick, holy knight of the Sunless Realms.  This light gold armor, named for its sunset hues, is now faded and wrapped in tainted rags.  The sorry fool was known to wander the battlefield as a crazed ghoul, lashing out at friend and foe alike."
26002000,Sunset Gauntlets,"Gauntlets of Hodrick, holy knight of the Sunless Realms.  These light gold gauntlets, named for their sunset hues, are now faded and wrapped in tainted rags.  The sorry fool was known to wander the battlefield as a crazed ghoul, lashing out at friend and foe alike."
26003000,Sunset Leggings,"Leggings of Hodrick, holy knight of the Sunless Realms.  These light gold leggings, named for their sunset hues, are now faded and wrapped in tainted rags.  The sorry fool was known to wander the battlefield as a crazed ghoul, lashing out at friend and foe alike."
26500000,Old Sage's Blindfold,"Attire of pyromancers of the Great Swamp, particularly favored by old sages.  The large blindfold blocks out unnecessary light, allowing one to observe a pyromancy's true essence.  The flame reveals all, and obscures all."
26501000,Cornyx's Garb,"Attire of Cornyx, pyromancer of the Great Swamp.  In the Great Swamp, it was customary to adorn oneself with articles of nature. Cornyx favored the use of raven feathers.  Ravens are said to have once been Firelink messengers, guiding the undead to the land of ancient gods."
26502000,Cornyx's Wrap,"Attire of Cornyx, pyromancer of the Great Swamp. The bronze ornamentation serves to ward off evil spirits."
26503000,Cornyx's Skirt,"Attire of Cornyx, pyromancer of the Great Swamp.  This long skirt emulates those worn by witches, who were the forebears of pyromancy."
27000000,Executioner Helm,"Steel helm of Horace the Hushed, who took a liking to its cold, bulky insides.  The original owner was said to be a corrupt executioner, who was killed and stripped of his armor.  Horace is one of only two children to escape Aldrich's clutches."
27001000,Executioner Armor,"Steel armor of Horace the Hushed, who took a liking to its cold, bulky insides.  The original owner was said to be a corrupt executioner, who was killed and stripped of his armor.  Horace is one of only two children to escape Aldrich's clutches."
27002000,Executioner Gauntlets,"Steel gauntlets of Horace the Hushed, who took a liking to their cold, bulky insides.  The original owner was said to be a corrupt executioner, who was killed and stripped of his armor.  Horace is one of only two children to escape Aldrich's clutches."
27003000,Executioner Leggings,"Steel leggings of Horace the Hushed, who took a liking to their cold, bulky insides.  The original owner was said to be a corrupt executioner, who was killed and stripped of his armor.  Horace is one of only two children to escape Aldrich's clutches."
27500000,Billed Mask,"Attire of the three mentors of the Sable Church of Londor, this billed mask belongs to Yuria, the second eldest.  These maidens of a Primordial Serpent were renowned as founders of the Sable Church, which offered salvation for Hollows."
27501000,Black Dress,"Attire of the three mentors of the Sable Church of Londor, this pitch-black dress resembles a mourning dress.  These maidens of a Primordial Serpent were renowned as founders of the Sable Church, which offered salvation for Hollows."
27502000,Black Gauntlets,"Attire of the three mentors of the Sable Church of Londor, these black gauntlets are hidden by the dress.  It is apparent that the women in black were highly skilled fencers, capable of founding the Sable Church between just the three of them."
27503000,Black Leggings,"Attire of the three mentors of the Sable Church of Londor, these black leggings are hidden by the dress.  It is apparent that the women in black were highly skilled fencers, capable of founding the Sable Church between just the three of them."
28000000,Pyromancer Crown,"Attire of pyromancers of the Great Swamp. Comprised of a leather crown and animal bones.  In the Great Swamp, it was thought that adorning oneself with natural fauna would provide protection from the flames of pyromancy."
28001000,Pyromancer Garb,"Attire of pyromancers of the Great Swamp. Comprised of bronze ornamentation and animal pelt.  In the Great Swamp, bronze was used ritualistically to ward off evil spirits and keep darkness at bay."
28002000,Pyromancer Wrap,Attire of pyromancers of the Great Swamp. Leather wrapped plainly around the arms.
28003000,Pyromancer Trousers,"Attire of pyromancers of the Great Swamp. Cloth trousers wound tightly with leather, and fitted with dermis split-toe shoes.  The life of a pyromancer is a life of endless trudging through marshland."
29000000,Court Sorcerer Hood,"Hood worn by court sorcerers of the Profaned Capital.  This tall, dark headpiece suggests they may have also been oracles.  There are many sorcerers who claim to heirship to the great sage ""Big Hat"" Logan, and the Profaned Capital houses one of two leading schools."
29001000,Court Sorcerer Robe,"Robe worn by court sorcerers of the Profaned Capital.  The formal gold stitching suggests they may have also been oracles.  There are many sorcerers who claim heirship to the great sage ""Big Hat"" Logan, and the Profaned Capital houses one of two leading schools."
29002000,Court Sorcerer Gloves,"Silk gloves worn by court sorcerers of the Profaned Capital. These figures may have also been oracles.  There are many sorcerers who claim heirship to the great sage ""Big Hat"" Logan, and the Profaned Capital houses one of two leading schools."
29003000,Court Sorcerer Trousers,"Trousers worn by court sorcerers of the Profaned Capital. These figures may have also been oracles.  There are many sorcerers who claim heirship to the great sage ""Big Hat"" Logan, and the Profaned Capital houses one of two leading schools."
30000000,Sorcerer Hood,"Attire of a sorcerer from the Vinheim Dragon School. A simple hood worn inside the robes.  Represents those who have outgrown the academy, abandoning formal headwear and distancing themselves in order to continue their research in solitude."
30001000,Sorcerer Robe,"Attire of a sorcerer from the Vinheim Dragon School. Long, ash-colored robes.  Underneath is a deep blue sorcerer's coat; conventional uniform of the academy."
30002000,Sorcerer Gloves,Attire of a sorcerer from the Vinheim Dragon School. Black-dyed leather gloves embellished with silver medallions.
30003000,Sorcerer Trousers,Attire of a sorcerer from the Vinheim Dragon School. Black-dyed leather trousers and rugged boots.  A sorcerer knows that long-term research means a lengthy and arduous road ahead.
30101000,Clandestine Coat,"Traditional coat of the Vinheim Dragon School.  Normally a deep blue color, this black variation is a sign of a sorcerer engaged in surreptitious work. These were covert agents who excelled at manipulating sound."
31000000,Cleric Hat,"Hat worn by a cleric turned undead. Typical attire for blue-robed travelers.  It is said that they were entrusted with a duty, still its nature is yet to be revealed."
31001000,Cleric Blue Robe,Garb worn by a cleric turned undead. Unmistakable vibrant blue robes.  It is said that the blue-robed travelers were entrusted with a duty. They bore large covers on their backs to ensure that they would not become seedbeds for spreading darkness.
31002000,Cleric Gloves,"Gloves worn by a cleric turned undead. Typical attire for blue-robed travelers.  It is said that they were entrusted with a duty, still its nature is yet to be revealed."
31003000,Cleric Trousers,"Trousers worn by a cleric turned undead. Typical attire for blue-robed travelers.  It is said that they were entrusted with a duty, still its nature is yet to be revealed."
31101000,Dingy Maiden's Overcoat,"Dingy overcoat worn by traveling maidens.  Although stained from a long journey, this item has yet to lose its divine power, remaining effective as a piece of protective wear."
33000000,Grotto Hat,"Hat of a sorcerer who distanced himself from this world.  Looks terribly worn-out, but the fabric's surface is reinforced with magic."
33001000,Grotto Robe,"Robe of a sorcerer who distanced himself from this world.  Looks terribly worn-out, but the fabric's surface is reinforced with magic."
33002000,Grotto Wrap,"Gloves of a sorcerer who distanced himself from this world.  Looks terribly worn-out, but the fabric's surface is reinforced with magic."
33003000,Grotto Trousers,"Waistcloth of a sorcerer who distanced himself from this world.  Looks terribly worn-out, but the fabric's surface is reinforced with magic."
40000000,Steel Soldier Helm,"Typical helm for a Lothric soldier. Iron-made, but half fallen apart.  It is never unwise to wear a sturdy form of head protection against arrows and other somatic threats."
40001000,Deserter Armor,"Common soldier's armor. Its insignia is worn beyond recognition.  This musty, rusted hunk of metal befits one reduced to thievery."
40002000,Soldier's Gauntlets,"Gauntlets supplied to common soldiers protecting Lothric.  Its simple build offers the bare minimum of protection in battle, but is comparatively lightweight and manageable."
40003000,Deserter Trousers,"Common soldier's trousers.  This musty, rusted hunk of metal befits one reduced to thievery."
40100000,Soldier's Hood,"Hood supplied to common soldiers protecting Lothric.  Its simple build offers the bare minimum of protection in battle, but is comparatively lightweight and manageable."
40200000,Thief Mask,"Mask worn by those with something to hide. Used to conceal the face, muffle the voice, and go by cover of darkness."
43000000,Sage's Big Hat,"Enormous hat that completely obscures the face. Belonged to twin gurus known as the Crystal Sages.  The pair are said to be successors to the great sage Logan, and this big hat is a symbol of their pedigree."
43001000,Elder's Robe,"Robe worn by an elder who went to the extremes of sorcery.  These robes have served the elder over many years of devoted study. Constantly exposed to magical power, they became formal wear for high-ranking sorcerers."
44000000,Aristocrat's Mask,"Mask worn by jailers of Irithyll Dungeon. Noblemen delighted in its plump features.  The jailers were among the few survivors inhabiting the Profaned Capital, later serving under Pontiff Sulyvahn. Perhaps the screams emanating from the cells help them forget their old home."
44001000,Jailer Robe,"Robe worn by jailers of Irithyll Dungeon. Originally ritualistic formal wear.  The jailers were among the few survivors inhabiting the Profaned Capital, later serving under Pontiff Sulyvahn. Perhaps the screams emanating from the cells help them forget their old home."
44002000,Jailer Gloves,"Gloves worn by jailers of Irithyll Dungeon.  The jailers were among the few survivors inhabiting the Profaned Capital, later serving under Pontiff Sulyvahn. Perhaps the screams emanating from the cells help them forget their old home."
44003000,Jailer Trousers,"Trousers worn by jailers of Irithyll Dungeon.  The jailers were among the few survivors inhabiting the Profaned Capital, later serving under Pontiff Sulyvahn. Perhaps the screams emanating from the cells help them forget their old home."
44500000,Saint's Veil,"Veil worn by the young crossbreed taken prisoner within the dungeon.  Originally pure white, years of incarceration have stained it ash grey."
44501000,Saint's Dress,"Dress worn by the young crossbreed taken prisoner within the dungeon.  Originally pure white, years of incarceration have stained it ash grey."
45000000,Footman's Hood,"Hood worn by a manservant who roams the Undead Commune.  The lowly footmen were given the most dejectable tasks among citizens of the Undead Commune. Their superhuman strength far exceeds that of an ordinary person, and if agitated can become quite uncontrolable."
45001000,Footman's Overcoat,"Overcoat worn by a manservant who roams the Undead Commune.  The lowly footmen were given the most dejectable tasks among citizens of the Undead Commune. Their superhuman strength far exceeds that of an ordinary person, and if agitated can become quite uncontrolable."
45002000,Footman's Bracelets,"Bracelets worn by a manservant who roams the Undead Commune.  The lowly footmen were given the most dejectable tasks among citizens of the Undead Commune. Their superhuman strength far exceeds that of an ordinary person, and if agitated can become quite uncontrolable."
45003000,Footman's Trousers,"Trousers worn by a manservant who roams the Undead Commune.  The lowly footmen were given the most dejectable tasks among citizens of the Undead Commune. Their superhuman strength far exceeds that of an ordinary person, and if agitated can become quite uncontrolable."
46000000,Grave Warden Hood,"Rotting, tattered hood. Attire of grave wardens at the Cathedral of the Deep.  Grave wardens were tasked with disposing of the ever rising corpses that plagued the cathedral. Their clothes are utterly putrid, drenched in the blood and mucilage of their undertaking."
46001000,Grave Warden Robe,"Rotting, tattered robe. Attire of grave wardens at the Cathedral of the Deep.  Grave wardens were tasked with disposing of the ever rising corpses that plagued the cathedral. Their clothes are utterly putrid, drenched in the blood and mucilage of their undertaking."
46002000,Grave Warden Wrap,"Rotting, tattered wrap. Attire of grave wardens at the Cathedral of the Deep.  Grave wardens were tasked with disposing of the ever rising corpses that plagued the cathedral. Their clothes are utterly putrid, drenched in the blood and mucilage of their undertaking."
46003000,Grave Warden Skirt,"Rotting, tattered skirt. Attire of grave wardens at the Cathedral of the Deep.  Grave wardens were tasked with disposing of the ever rising corpses that plagued the cathedral. Their clothes are utterly putrid, drenched in the blood and mucilage of their undertaking."
47000000,Worker Hat,"Hat worn by inhabitants of the Undead Settlement.  Official attire for the dissection and burial of undead. Naturally, the ceremonial significance of such work is long forgotten.  Indeed, no one could continue to entertain such horrors."
47001000,Worker Garb,"Garb worn by inhabitants of the Undead Settlement.  Official attire for the dissection and burial of undead. Naturally, the ceremonial significance of such work is long forgotten.  Indeed, no one could continue to entertain such horrors."
47002000,Worker Gloves,"Gloves worn by inhabitants of the Undead Settlement.  Official attire for the dissection and burial of undead. Naturally, the ceremonial significance of such work is long forgotten.  Indeed, no one could continue to entertain such horrors."
47003000,Worker Trousers,"Trousers worn by inhabitants of the Undead Settlement.  Naturally, the ceremonial significance of such work is long forgotten.  Indeed, no one could continue to entertain such horrors."
47500000,Thrall Hood,Hood used to cover the head of lesser folk who were set to work as slaves throughout Lothric.  Also occasionally used to shame and humiliate criminals.
48000000,Evangelist Hat,"Hat of an evangelist sent from the cathedral.  These teachers, all women, came to enlighten inhabitants of the Undead Settlement and sent carriers on the path of sacrifice."
48001000,Evangelist Robe,"Robe of an evangelist sent from the cathedral.  These teachers, all women, came to enlighten inhabitants of the Undead Settlement and sent carriers on the path of sacrifice."
48002000,Evangelist Gloves,"Gloves of an evangelist sent from the cathedral.  These teachers, all women, came to enlighten inhabitants of the Undead Settlement and sent carriers on the path of sacrifice."
48003000,Evangelist Trousers,"Trousers of an evangelist sent from the cathedral.  These teachers, all women, came to enlighten inhabitants of the Undead Settlement and sent carriers on the path of sacrifice."
48500000,Scholar's Shed Skin,"Skin shed from a sage of the Grand Archives. The ivory wax has hardened, forming a mask.  Wax protected the inquirer from exposure to the foulness that permeated the majority of the texts, preventing one's anchor of reason from being too easily washed away."
48501000,Scholar's Robe,"Robe of a sage from the Grand Archives, stained quite deliberately with wax.  The scholars of the Grand Archives, sorcerers by craft, tend to their candles with a reverence that exceeds the simple burden of labor. They know dangers of the Archives' store of knowledge all too well."
49000000,Winged Knight Helm,"Armor of the Winged Knights, who swore themselves to the Angels.  Worship of the divine messengers was viewed as heresy in Lothric and unrecognized by any of the Three Pillars of rule.  This is believed to be why Gertrude, the Heavenly Daughter, was imprisoned in the lofty cell of the Grand Archives."
49001000,Winged Knight Armor,"Armor of the Winged Knights, named for their appearance, who swore themselves to the Angels.  Worship of the divine messengers was viewed as heresy in Lothric and unrecognized by any of the Three Pillars of rule.  This is believed to be why Gertrude, the Heavenly Daughter, was imprisoned in the lofty cell of the Grand Archives."
49002000,Winged Knight Gauntlets,"Armor of the Winged Knights, who swore themselves to the Angels.  Worship of the divine messengers was viewed as heresy in Lothric and unrecognized by any of the Three Pillars of rule.  This is believed to be why Gertrude, the Heavenly Daughter, was imprisoned in the lofty cell of the Grand Archives."
50500000,Cathedral Knight Helm,"Massive iron helm worn by knights serving the Cathedral of the Deep.  Repulsive creatures of the deep are sure to attract the foolish, but the cathedral knights are prepared to meet such intruders head on with their more than ample might."
50501000,Cathedral Knight Armor,"Massive iron armor worn by knights serving the Cathedral of the Deep.  Repulsive creatures of the deep are sure to attract the foolish, but the cathedral knights are prepared to meet such intruders head on with their more than ample might."
50502000,Cathedral Knight Gauntlets,"Massive iron gauntlets worn by knights serving the Cathedral of the Deep.  Repulsive creatures of the deep are sure to attract the foolish, but the cathedral knights are prepared to meet such intruders head on with their more than ample might."
50503000,Cathedral Knight Leggings,"Massive iron leggings worn by knights serving the Cathedral of the Deep.  Repulsive creatures of the deep are sure to attract the foolish, but the cathedral knights are prepared to meet such intruders head on with their more than ample might."
52000000,Lothric Knight Helm,"Armor of a celebrated Lothric knight. A strong steel helm, if a little worn.  The Knight has served as one of the Three Pillars since ancient times, and shares place alongside the wyverns as a symbol of Lothric.  Only those possessing a knight's resolve are fit to wear this garment."
52001000,Lothric Knight Armor,"Armor of a celebrated Lothric knight. The coat of distinction is all but fallen apart.  The Knight has served as one of the Three Pillars since ancient times, and shares place alongside the wyverns as a symbol of Lothric.  Only those possessing a knight's resolve are fit to wear this garment."
52002000,Lothric Knight Gauntlets,"Armor of a celebrated Lothric knight. Strong steel gauntlets, if a little scratched.  The Knight has served as one of the Three Pillars since ancient times, and shares place alongside the wyverns as a symbol of Lothric.  Only those possessing a knight's resolve are fit to wear this garment."
52003000,Lothric Knight Leggings,"Armor of a celebrated Lothric knight. Strong steel leggings, if a little scratched.  The Knight has served as one of the Three Pillars since ancient times, and shares place alongside the wyverns as a symbol of Lothric.  Only those possessing a knight's resolve are fit to wear this garment."
53000000,Outrider Knight Helm,"Armor of an Irithyll outrider knight. Enveloped in a dimly cool air.  The knights were given the eyes of the Pontiff, but the eyes transformed them into savage, raving warriors who only knew how to serve as mindless guards."
54000000,Black Knight Helm,"Armor of the Black Knights who roam the lands.  The knights served the First Lord Gwyn, and followed him into the flame upon its linking. They became ash, but still wander the realms to this day."
54500000,Dark Mask,"Bone mask of the Darkwraiths, relics of a small country that fell to the dark long ago. Looks as if it may crumble to dust at any moment.  The Darkwraiths were the oldest of the Red Eye Invaders, and rumored to have served a Primordial Serpent."
54501000,Dark Armor,"Armor of the Darkwraiths, relics of a small country that fell to the dark long ago. Looks as if it may crumble to dust at any moment.  The Darkwraiths were the oldest of the Red Eye Invaders, and rumored to have served a Primordial Serpent."
54502000,Dark Gauntlets,"Gauntlets of the Darkwraiths, relics of a small country that fell to the dark long ago. Look as if they may crumble to dust at any moment.  The Darkwraiths were the oldest of the Red Eye Invaders, and rumored to have served a Primordial Serpent."
54503000,Dark Leggings,"Leggings of the Darkwraiths, relics of a small country that fell to the dark long ago. Look as if they may crumble to dust at any moment.  The Darkwraiths were the oldest of the Red Eye Invaders, and rumored to have served a Primordial Serpent."
55000000,Exile Mask,"Iron mask of the watchdogs of Farron's Keep.  After the Legion's Watchers became Lords of Cinder, the wolf blood dried up, and Farron was consumed by a festering wood.  Within the wood, an emaciated old wolf commands watchdogs to defend the sanctity of sleeping warriors.  Both the exiles were surely watchdogs themselves, for Farron has always been a land of itinerants."
55001000,Exile Armor,"Armor of the watchdogs of Farron's Keep.  After the Legion's Watchers became Lords of Cinder, the wolf blood dried up, and Farron was consumed by a festering wood.  Within the wood, an emaciated old wolf commands watchdogs to defend the sanctity of sleeping warriors.  Both the exiles were surely watchdogs themselves, for Farron has always been a land of itinerants."
55002000,Exile Gauntlets,"Gauntlets of the watchdogs of Farron's Keep.  After the Legion's Watchers became Lords of Cinder, the wolf blood dried up, and Farron was consumed by a festering wood.  Within the wood, an emaciated old wolf commands watchdogs to defend the sanctity of sleeping warriors.  Both the exiles were surely watchdogs themselves, for Farron has always been a land of itinerants."
55003000,Exile Leggings,"Leggings of the watchdogs of Farron's Keep.  After the Legion's Watchers became Lords of Cinder, the wolf blood dried up, and Farron was consumed by a festering wood.  Within the wood, an emaciated old wolf commands watchdogs to defend the sanctity of sleeping warriors.  Both the exiles were surely watchdogs themselves, for Farron has always been a land of itinerants."
56000000,Pontiff Knight Crown,"Crown of the Pontiff's Knights, now harrowed spirits of Irithyll.  The golden crown signifies those who report directly to Sulyvahn. The knights were his watchful eyes, and when needed, his punitive blades."
56001000,Pontiff Knight Armor,"Armor of the Pontiff's Knights, now harrowed spirits of Irithyll.  This blue-gray armor, shrouded in a thinly cold air, is light and brittle."
