id,name,description
3100,Magic Weapon,Sorcery for casters who wield swords. Magic augmentation: right weapon.  The power of the magic swordsmen of Vinheim is predicated upon this and Magic Shield. Many warriors learn sorcery just for this.
3110,Great Magic Weapon,"Sorcery which improves upon Magic Weapon. High magic augmentation: right weapon.  At Vinheim Dragon School, only magic swordsmen on special orders are allowed to learn this spell which grants powerful augmentation to various weapons."
3120,Crystal Magic Weapon,"Sorcery boosted by the knowledge. Logan acquired at the Regal Archive. High magic + crystallization: right weapon  Logan's trials were successful, and the crystal medium facilitated a stronger bond between weapon and soul."
3300,Magic Shield,Sorcery for casters who wield swords. Magic augmentation: left shield.  Shields augmented by magic are resistant to magic attacks and have higher stability. This spell makes it possible to challenge powerful foes with a small shield.
3310,Strong Magic Shield,"Sorcery which improves upon Magic Shield. High magic augmentation: left shield.  At Vinheim Dragon School, only magic swordsmen on special orders are allowed to learn this spell which grants temporary strength to greatshields."
3400,Hidden Weapon,"Ancient sorcery of the lost land of Oolacile. Turns right weapon invisible.  Not a simple augmentation, making it dependent on the skill of its caster.  An example of the capacity of Oolacile sorceries to control light."
3410,Hidden Body,"Ancient sorcery of the lost land of Oolacile. Turns body nearly invisible.  Although perfect invisibility is unachievable due to the risk of dissipation, the caster need only stand still for a moment to blend in to environs with astounding camouflage."
3500,Cast Light,Ancient sorcery of the lost land of Oolacile. Cast a bright light upon surroundings.  This light-producing sorcery is elementary but nonetheless demonstrates the achievements in mysticism of Oolacile. Such magic has not been developed even in Vinheim.
3510,Hush,"Sorcery developed by a certain surreptitious sorcerer at Vinheim Dragon School. Masks all noises of caster.  Effectively, Vinheim is controlled by the Dragon School, and it is no wonder that the town has its share of dark secrets."
3520,Aural Decoy,"Sorcery used by playful sorcerers. Lure enemies away by creating a sound originating in the distance.  This spell is not the first choice for serious sorcerers, but it has a surprising amount of applications, some of them extremely effective."
3530,Repair,"Ancient sorcery of the lost land of Oolacile. Repair equipped weapons and armor.  This sorcery was a part of everyday life in Oolacile. Its effects resemble Repair Powder, which must have found its way into the culture of this lost land."
3540,Fall Control,"Sorcery developed by a certain surreptitious sorcerer at Vinheim Dragon School. Reduce damage and noise from fall.  This sorcery, along with Hush, explains the extravagant cost of hiring Vinheim spooks."
3550,Chameleon,Ancient sorcery of the lost land of Oolacile. Transform into something inconspicuous.  A separate stealth spell from Hidden Body. A skilled stealth sorcerer must be aware of his or her surroundings and of which objects are prime candidates for imitation.
3600,Resist Curse,"Sorcery of the red-robed remedician. Ingward, guardian of the seal in New Londo Sacrifice humanity to undo curse.  Abhorrent curses eat away at the core of one's very existence, and cleansing oneself of curses is no easy task indeed."
3610,Remedy,"Sorcery of the red-robed Yulva, one of the Sealers of New Londo. Reduce bleeding and poison build-up, and undo various poisonous effects.  One of New Londo's unique healing sorceries. Perhaps she abandoned her Sealer duty to take her healing arts back to Blighttown."
3700,White Dragon Breath,"Sorcery developed by Logan during his infatuation with Seath the Scaleless. Emit crystal breath of Seath the Scaleless.  Although it no longer causes curses, what madness caused old Big Hat to appropriate this frightful power of the ancient dragons?"
4000,Fireball,"Standard pyromancy of the Great Swamp. Hurl fireball.  The fire damage caused by fireballs makes them effective against corporeal beasts and Undead, who by nature fear flame."
4010,Fire Orb,"Pyromancy which improves upon Fireball. Hurl fire orb.  The flaming fire orb explodes upon impact, causing fire splash damage in a spectacle which seems to symbolize the strength of the fire-manipulating pyromancers."
4020,Great Fireball,"Ultimate fireball pyromancy. Hurl giant fireball.  Salaman the Master Pyromancer, also called the Great Fireball after this spell, believed pyromancy was rooted in an adoration of fire. Those who acquire this spell usually agree."
4030,Firestorm,"Primal pyromancy taught by Quelana of Izalith. Erect fire pillars in vicinity.  The storm of flame is indiscriminate, and incinerates all nearby life."
4040,Fire Tempest,Primal pyromancy of Quelana of Izalith. Erect giant fire pillars in vicinity.  The tempestuous raging flames resemble those summoned by the Daughters of Chaos when they challenged the ancient dragons and scorched the very earth.
4050,Fire Surge,"Pyromancy foreign to the Great Swamp. Create a surge of flame from palm of hand.  Not all pyromancy originates in the Great Swamp. One hears rumors of unknown pyromancers inhabiting various lands, and this spell is the work of one such outlander."
4060,Fire Whip,"Primal pyromancy taught by Quelana of Izalith. Sweep foes with fire whip.  The root pyromancy of Combustion, but much more difficult to wield."
4100,Combustion,"Elementary pyromancy. Create powerful flame in hand.  One of the most basic pyromancies. For this very reason, the flame thus created is fierce."
4110,Great Combustion,"Pyromancy which improves upon Combustion. Create powerful, giant flame in hand.  Great Combustion creates a powerful flame, but many sorcerers mock the simplicity of this spell."
4200,Poison Mist,"Unique pyromancy crafted by Eingyi, considered a heretic even at the Great Swamp Create poison mist.  Eingyi became an egg-bearing Undead who serves a deformed young girl who speaks an unintelligible tongue."
4210,Toxic Mist,"Unique pyromancy crafted by Eingyi, considered a heretic even at the Great Swamp Create intense poison mist.  Why was Eingyi driven from the Great Swamp? One only need cast this pyromancy, a perverse diversion from the art of fire, to find out."
4220,Acid Surge,"Pyromancy foreign to the Great Swamp. Emit acid which corrodes weapons and armor.  Not all pyromancy originates in the Great Swamp. One hears rumors of unknown pyromancers inhabiting various lands, and this spell is the work of one such outlander."
4300,Iron Flesh,"Pyromancy of Carmina, who harnessed the power of flame to actualize the inner-self. Iron flesh boosts defense and resilience.  Use of this pyromancy requires caution, as the caster becomes exceedingly heavy and unable to move freely."
4310,Flash Sweat,"Pyromancy of Carmina, who harnessed the power of flame to actualize the inner-self. Intense sweating reduces flame damage.  Carmina, the most accomplished pupil of Salaman the Master Pyromancer, pioneered new directions for the art of pyromancy."
4360,Undead Rapport,"Advanced pyromancy of Quelana of Izalith. Charm Undead and gain temporary allies.  The living are lured by flame, and this relationship is part and parcel to the art of pyromancy. Can be used by either gender."
4400,Power Within,"Pyromancy of Carmina, who harnessed the power of flame to actualize the inner-self. Short strength/endurance boost, but lose HP.  Excessive power eats away the life-force of its caster, and like all dangerous spells, Power Within was kept secret for eons."
4500,Great Chaos Fireball,"Art of the Flame of Chaos, which engulfed the Witch of Izalith and her daughters. Hurl giant chaos fireball, which changes strength depending on humanity.  The Flame of Chaos can melt stone, producing a short-lived lava glob."
4510,Chaos Storm,"Art of the Flame of Chaos, which engulfed the Witch of Izalith and her daughters. Erect localized chaos fire pillars which change strength depending on humanity.  The Witch of Izalith, in an ambitious attempt to copy the First Flame, created instead the Flame of Chaos, a twisted bed of life."
4520,Chaos Fire Whip,"Art of the Flame of Chaos, which engulfed the Witch of Izalith and her daughters. Sweep foes with chaos fire whip which changes strength depending on humanity.  The fire whip was wielded by the eldest of the Daughters of Chaos."
5000,Heal,"Elementary miracle cast by clerics. Restores HP.  To cast a miracle, the caster learns a tale of the Gods, and says a prayer to be blessed by its revelations. Heal is the shortest of such miraculous tales."
5010,Great Heal,"Great miracle cast by advanced clerics. Restores high HP.  Great Heal is a long tale, only learned by a select few. No caster will be disappointed by the bountiful life that it yields."
5020,Great Heal Excerpt,"Great miracle cast by advanced clerics. Restores high HP.  Great Heal Excerpt borrows from only several verses of Great Heal. As a result, it can only be cast a stark few times."
5030,Soothing Sunlight,"Special miracle granted to the maidens of Gwynevere, Princess of the Sun. Restores high HP for self and vicinity.  The miracles of Gwynevere, the princess  cherished by all, grant their blessing to a great many warriors."
5040,Replenishment,"Common miracle amongst cleric knights. Gradual HP restoration.  Beware of the cleric knight blessed by Replenishment, for he shall not fall easily."
5050,Bountiful Sunlight,"Special miracle granted to the maidens of Gwynevere, Princess of the Sun. Gradual HP restoration for self and vicinity.  The miracles of Gwynevere, the princess  cherished by all, grant their blessing to a great many warriors."
5100,Gravelord Sword Dance,"Miracle known only by the servants of the first dead, Gravelord Nito. Giant Gravelord swords jut out in vicinity.  Nito sleeps deep within the Giant Catacombs, quietly overseeing all death, and waiting for his servants to usher in the Eye of Death."
5110,Gravelord Greatsword Dance,"Miracle known only by the servants of the first dead, Gravelord Nito. Giant Gravelord swords jut out in vicinity.  Many have died, and many eyes were claimed to realize the Greatsword Dance, a Gravelord ritual known only by his closest servants."
5200,Denial,"Lost miracle, foreign to the Way of White While active, no losses incurred upon death  The Way of White recognizes death itself, but admonishes the Undead. It is for this very reason that this miracle was lost."
5210,Homeward,"Great miracle cast by advanced clerics. Return to last bonfire rested at.  Would normally link to one's homeland, only the curse of the Undead has distorted its power, redirecting casters to a bonfire. Or perhaps for Undead, this serves as home?"
5300,Force,"Common miracle amongst cleric knights. Create shockwave.  This quickly-acting miracle inflicts no damage, but propels foes back and defends against arrows. Cleric knights use this miracle when charging into enemy mobs."
5310,Wrath of the Gods,Primal form of Force. Create powerful shockwave.  Wrath of the Gods was an epic tale that tattered over time and devolved into the modern Force. This primal form of Force emits a shockwave that also inflicts damage.
5320,Emit Force,"Outland miracle, foreign to the Way of White. Emit shockwave.  Considered an alternate branching of Force. Emits an expanding shockwave orb."
5400,Seek Guidance,"Miracle of clerics on an Undead mission. Display more guidance from other worlds.  Guidance facilitates communication between Undead, but their value varies greatly. A balance of faith and wisdom is required."
5500,Lightning Spear,"Miracle passed down to those bound by the Warrior of Sunlight covenant. Hurl lightning spear.  Lightning spears inflict rare lightning damage, and are very effective against magic, fire, and most of all, dragons."
5510,Great Lightning Spear,"Miracle passed down to those bound by the Warrior of Sunlight covenant. Hurl giant lightning spear.  The weapon of the God of War, who inherited the sunlight of Lord Gwyn, but had respect only for arms, and nothing else."
5520,Sunlight Spear,"Miracle born from the fading soul of Gwyn. Hurl sunlight spear.  In the war that marked the dawn of the Age of Fire, Gwyn wielded these rays of sunlight, which remain fierce even as they fade."
5600,Magic Barrier,"Miracle of Bishop Havel the Rock. Cover body in defensive magic coating.  This coating greatly boosts magic defense, assisting warriors who must face the magic which Bishop Havel countered so proficiently."
5610,Great Magic Barrier,"Miracle of Bishop Havel the Rock. Cover body in powerful def. magic coating.  Havel the Rock, an old battlefield compatriot of Lord Gwyn, was the sworn enemy of Seath the Scaleless. He despised magic, and made certain to devise means of counteraction."
5700,Karmic Justice,"Miracle of the black-haired witch Velka. Temporary auto counter vs. heavy damage.  For each sin there is a punishment, and it is the task of Goddess Velka to define the sin, and mete out the punishment."
5800,Tranquil Walk of Peace,"Outland miracle, foreign to the Way of White. Slows all walking within effect area.  This miracle is normally used to flee, as it slows walking but does not affect attacks, but nevertheless defines peace perfectly."
5810,Vow of Silence,"Secret rite of the black-haired witch Velka. Prevents casting of magic within effect area.  Velka, the Goddess of Sin, is a rogue deity, but she is versed in arts both new and old, and is considered to have a great range of influence even as gods are concerned."
5900,Sunlight Blade,"Miracle wielded by Lord Gwyn's firstborn. Boost right weapon with rays of Sun.  The power of sunlight, manifested as lightning, is very effective against dragons. When the eldest son was stripped of his deific status, he left this on his father's coffin, perhaps as a final farewell."
5910,Darkmoon Blade,"Miracle granted to those bound by covenant to Gwyndolin, Lord Gwyn's lastborn. Boost right weapon with rays of Darkmoon.  The power of the rays of the Darkmoon are manifested in vengeance, and the deeper the animus, the more devastating the attack."
1200000,Farron Dart,"Variation of Soul Arrow developed by sorcerers of the Undead Legion of Farron.  Fire a soul dart.  Well known among the Farron sorceries, it is learned far and wide due to its ease of use."
1210000,Great Farron Dart,"Sorcery which improves upon Farron Dart. Fires a more powerful soul dart.  Entrusted to the leader of the Legion's acolytes, and apparently a sorcery of his daughter, Heysel, that was refined by a Crystal Sage."
1300000,Soul Arrow,"Elementary sorcery. Fires a soul arrow.  To use sorceries, equip a staff and attune a sorcery at a bonfire."
1301000,Great Soul Arrow,"Sorcery which improves upon Soul Arrow. Fires a more powerful soul arrow.  Many sorceries inflict magic damage, making them effective against iron armor, tough scales, and other physically resilient materials."
1302000,Heavy Soul Arrow,"Elementary, yet practical sorcery from long ago. Fires a heavy soul arrow.  Offers greater power but slower casting time, entailing a vulnerability that makes this sorcery trickier to handle."
1303000,Great Heavy Soul Arrow,Sorcery which improves upon Heavy Soul Arrow. Fires a more powerful heavy soul arrow.  Sorceries are a logical discipline; their strength influenced by the caster's intelligence.
1304000,Homing Soulmass,"Sorcery developed by Big Hat Logan, the great sorcerer who left the Dragon School in an age long past.  Releases a homing soulmass.  This sorcery may offer a clue as to what Logan sought, but further investigation suggests its attraction to living things mirrors the nature of the dark."
1305000,Homing Crystal Soulmass,"Sharpens Homing Soulmass via crystallization.  Releases a homing crystal soulmass. Crystal soulmass has piercing qualities.  According to the Crystal Sages, old Big Hat achieved enlightenment within the Regal Archives, where he came to find the quintessence of sorcery in the facets of a certain crystal."
1306000,Soul Spear,"Sorcery developed by Big Hat Logan, the great sorcerer who left the Dragon School in an age long past.  Fires a soul spear.  The spear boasts superior penetrating power, and is testament to Logan's strength in battle,"
1307000,Crystal Soul Spear,"Further sharpens Soul Spear via crystallization.  Fires a piercing crystal soul spear.   According to the Crystal Sages, old Big Hat achieved enlightenment within the Regal Archives, where he came to find the quintessence of sorcery in the facets of a certain crystal."
1308000,Deep Soul,"Sorcery of Archdeacon Royce and his deacons, said to have been imparted to them by McDonnell of the Boreal Valley.  Fires dark soul dregs.  Souls which swell from the deep pursue their target, drawn towards life."
1309000,Great Deep Soul,"Sorcery which improves upon Deep Soul. Fires powerful darkened soul dregs.  Archdeacon McDonnell, a sorcerer himself, delighted in the cathedral's stagnating souls. For him, they represented the glorious bedrock of this world."
1310000,Magic Weapon,Sorcery for casters who wield swords. Reinforces right weapon with magic.  The power of the sorcerer-swordsmen of Vinheim is predicated upon this and Magic Shield. Many warriors learn sorcery just for this enchantment.
1311000,Great Magic Weapon,Sorcery which improves upon Magic Weapon. Greatly reinforces right weapon with magic.  Only sorcerer-swordsmen with special duties are permitted the use of this spell. The azure blade is said to cut down heavily armored knights with ease.
1312000,Crystal Magic Weapon,"Further sharpens Magic Weapon via crystallization. Reinforces right weapon with crystal.  After much experimentation, Logan found the crystal medium facilitated a stronger bond between weapon and soul."
1330000,Magic Shield,Sorcery for casters who wield swords. Reinforces left shield with magic.  Shields augmented by magic have higher stability and damage absorption.  Even the smallest of shields can be toughened considerably with the use of this spell.
1331000,Great Magic Shield,"Sorcery which improves upon Magic Shield. Greatly reinforces left shield with magic.  Only sorcerer-swordsmen with special duties are permitted the use of this spell, which temporarily grants even the smallest of shields fortitude more akin to that of a greatshield."
1340000,Hidden Weapon,"Lost sorcery from Oolacile, land of ancient golden sorceries. Turns right weapon invisible.  The weapon itself undergoes no inherent changes. Effective use of this, like any tool, perhaps, is reliant upon the ingenuity of its caster."
1341000,Hidden Body,"Lost sorcery from Oolacile, land of ancient golden sorceries. Turns body nigh on invisible.  Although perfect invisibility is unachievable due to the risk of dissipation, the caster need only stand still for a moment to blend in to environs with astounding camouflage."
1350000,Cast Light,"Lost sorcery from Oolacile, land of ancient golden sorceries. Casts a light to illuminate surroundings.  This light-producing magic is elementary but nonetheless demonstrates the pure nature of golden sorceries; the likes of which have not been developed even at the Dragon School."
1353000,Repair,"Lost sorcery from Oolacile, land of ancient golden sorceries.  Repairs equipped weapons and armor. Includes weapons with exhausted durability.  While the effects of this spell are rather subtle, its foundations are a well-guarded secret. Light is time, and the reversal of its effects is a forbidden art."
1354000,Spook,Sorcery developed by a certain surreptitious sorcerer at Vinheim Dragon School.  Masks noises of the caster and prevents fall damage.  Their mastery of this sorcery alone allows Vinheim spooks to demand handsome payment for their services.
1355000,Chameleon,"Lost sorcery from Oolacile, land of ancient golden sorceries. Transforms into something inconspicuous.  Far from formally developed, this magic was instead born from the mischief of a young girl who sought relief from the solitude of the woods at dusk."
1356000,Aural Decoy,Sorcery developed by a certain surreptitious sorcerer at Vinheim Dragon School.  Distracts foes with a distant sound.  The sound carries with it a strangely infectious resonance that may cause one to stray from their post and expose their back.
1370000,White Dragon Breath,"Sorcery of the deluded Consumed King Oceiros.  Emits crystal breath of Seath the Scaleless. Crystal breath has piercing qualities.  Seath's research seemed to strike a chord with old Big Hat who, in his mad, disrobed state, made divine works such as this, his own. Oceiros was no doubt edified by this."
1372000,Farron Hail,"Sorcery which improves upon Farron Dart. Fires a cascade of soul darts.  Entrusted to the leader of the Legion's acolytes, and apparently a sorcery of his daughter, Heysel, that was refined by a Crystal Sage."
1373000,Crystal Hail,"Unique sorcery developed by extraordinary preacher twins known as the Crystal Sages.  Casts a cascade of small crystal soulmasses from above. Crystal soulmasses have piercing qualities.  In a pact said to have been formed long ago, one of the Sages allied with the Undead Legion in order to train the sorcerers of Farron."
1374000,Soul Greatsword,"Sorcery developed primarily for sorcerer-swordsmen. Attacks with a greatsword formed from souls.  The ephemeral blade only exists as an extension of the caster, but its power is said to rival that of physical greatswords. Even the most obstinate magic purists may resort to this spell in times of crisis."
1375000,Farron Flashsword,"Alteration of Soul Greatsword developed by sorcerers of the Undead Legion of Farron.  The Legion has a tendency to emphasize speed over power, and this practical alteration of an existing sorcery is no exception."
1603000,Affinity,"A forbidden dark sorcery. Casts a dark manifestation of humanity.  It appears to be an expression of envy, or perhaps love towards another, that will tenaciously pursue its target. Even if, like so many human desires, it amounts to nothing but misfortune."
1613000,Dark Edge,"A forbidden dark sorcery. Strikes with blade formed of humanity's darkness.  Passed from mother to daughter, this blade was intended for both protection and as a means of taking one's own life. The young girl never swung it more than once."
1620000,Soul Stream,"Sorcery imparted by the first of the Scholars, when Lothric and the Grand Archives were but young.  Fires a torrential volley of souls.  The first of the Scholars doubted the linking of the fire, and was alleged to be a private mentor to the Royal Prince."
1651000,Twisted Wall of Light,"Lost sorcery from Oolacile, land of ancient golden sorceries. Distorts light in order to deflect magic.  A closely-guarded light manipulation spell that contorts the very fabric of fundamental laws, negating magic by denying its claim to physicality."
1740000,Pestilent Mercury,"Highly dangerous sorcery employed by Dragon School spooks. Only taught to trusted members.  Releases mercury that eats away at HP. Beware, as the caster is not immune to its effect.  A body caught in the silent mercury cloud lies still, while the face twists in a tortured scream. The names of these learned sorcerers became feared for this gruesome spectacle."
2400000,Fireball,"Elementary pyromancy that is often the first learned. Hurls a fireball.  To use pyromancies, equip a pyromancy flame and attune a pyromancy at a bonfire."
2402000,Fire Orb,"The signature flame-manipulating spell common to pyromancers. Hurls a giant fire orb.  The blazing fire orb explodes on impact, dealing fire damage to the surrounding area.  They say that once a pyromancer learns this spell, their understanding of the flame deepens, together with a yearning for it."
2403000,Firestorm,"Primal pyromancy taught by Quelana, a daughter of the Witch of Izalith.  Surrounds the caster with multiple pillars of flame.  The raging storm is indiscriminate; such is the intrinsic horror of the flame."
2405000,Fire Surge,"Pyromancy of Cornyx of the Great Swamp. Emits a constant stream of fire.  Cornyx is a venerable pyromancer of an older mold, said to have restored a number of spells lost to the past, amongst which this is the most well-known."
2406000,Fire Whip,"An ancient, primal pyromancy. Sweep foes with a whip-like flame.  One of the original pyromancies. Effective use of it demands agile footwork, making it a difficult spell for most."
2407000,Black Serpent,"Pyromancy discovered from the Abyss by High Lord Wolnir that inspired the black arts of the grave wardens.  Releases undulating black flames that trace the ground.  Be it sorcery or pyromancy, all techniques that infringe on humanity lead to the same place. That is to say, they all seek a will of their own."
2410000,Combustion,"An elementary spell for new pyromancers. Releases flame in front of the caster.  The simplest pyromancy of all, but surprisingly effective."
2411000,Great Combustion,"Pyromancy which improves upon Combustion. Creates a powerful, giant flame in hand.  A very powerful, yet simple spell to use.  Pyromancy is to at once know fear and longing, the resultant power of which depends on both the caster's intelligence and faith."
2420000,Poison Mist,"Unique pyromancy crafted by Eingyi, a heretic inhabiting the Great Swamp long ago. Creates a poison mist.  Eingyi was driven from the Great Swamp, however his pyromancy continues to succeed him.  Perhaps dwellers of the Great Swamp were reminded that their very existence is one rooted in heresy."
2421000,Toxic Mist,"Unique pyromancy of Eingyi that never gained currency in the Great Swamp.  Creates an intense poison mist.  Driven from the Great Swamp, they say that at the end of his journey, Eingyi happened upon a virulent poison and a young lady."
